{
  "version": 1,
  "pilot_id": "manufactured-pilot",
  "evidence_type": "synthetic",
  "endpoint": "outcome_quality",
  "task_source": "Manufactured balanced fixture, not researcher data",
  "independence_rationale": "Independent-family assumption is for this test fixture only",
  "records": [
    {
      "family_id": "pilot-family-0",
      "task_id": "pilot-task-0-0",
      "input_sha256": "c6de74b32f5215bbe80b67b9a98d2ab75b2b2a075e96228e963404ed68580a28",
      "repetition": 1,
      "with_score": 0.07999999999999992,
      "without_score": 0.42999999999999994,
      "with_run_id": "pilot-with-pilot-task-0-0-1",
      "without_run_id": "pilot-without-pilot-task-0-0-1",
      "with_session_id": "pilot-with-session-pilot-task-0-0-1",
      "without_session_id": "pilot-without-session-pilot-task-0-0-1",
      "source_ref": "local-fixture://pilot/pilot-task-0-0/1"
    },
    {
      "family_id": "pilot-family-0",
      "task_id": "pilot-task-0-0",
      "input_sha256": "c6de74b32f5215bbe80b67b9a98d2ab75b2b2a075e96228e963404ed68580a28",
      "repetition": 2,
      "with_score": 0.19999999999999996,
      "without_score": 0.44999999999999996,
      "with_run_id": "pilot-with-pilot-task-0-0-2",
      "without_run_id": "pilot-without-pilot-task-0-0-2",
      "with_session_id": "pilot-with-session-pilot-task-0-0-2",
      "without_session_id": "pilot-without-session-pilot-task-0-0-2",
      "source_ref": "local-fixture://pilot/pilot-task-0-0/2"
    },
    {
      "family_id": "pilot-family-0",
      "task_id": "pilot-task-0-1",
      "input_sha256": "6281cced5e22cd750be17520dd0c1b217c92fda3afb0a03ed74b738ba389ad63",
      "repetition": 1,
      "with_score": 0.32,
      "without_score": 0.47,
      "with_run_id": "pilot-with-pilot-task-0-1-1",
      "without_run_id": "pilot-without-pilot-task-0-1-1",
      "with_session_id": "pilot-with-session-pilot-task-0-1-1",
      "without_session_id": "pilot-without-session-pilot-task-0-1-1",
      "source_ref": "local-fixture://pilot/pilot-task-0-1/1"
    },
    {
      "family_id": "pilot-family-0",
      "task_id": "pilot-task-0-1",
      "input_sha256": "6281cced5e22cd750be17520dd0c1b217c92fda3afb0a03ed74b738ba389ad63",
      "repetition": 2,
      "with_score": 0.44,
      "without_score": 0.49,
      "with_run_id": "pilot-with-pilot-task-0-1-2",
      "without_run_id": "pilot-without-pilot-task-0-1-2",
      "with_session_id": "pilot-with-session-pilot-task-0-1-2",
      "without_session_id": "pilot-without-session-pilot-task-0-1-2",
      "source_ref": "local-fixture://pilot/pilot-task-0-1/2"
    },
    {
      "family_id": "pilot-family-1",
      "task_id": "pilot-task-1-0",
      "input_sha256": "b74d276f21a8303af2bdf1e8870f1a0071862eb8263f874dc0c1e3bca088c3dc",
      "repetition": 1,
      "with_score": 0.32,
      "without_score": 0.47,
      "with_run_id": "pilot-with-pilot-task-1-0-1",
      "without_run_id": "pilot-without-pilot-task-1-0-1",
      "with_session_id": "pilot-with-session-pilot-task-1-0-1",
      "without_session_id": "pilot-without-session-pilot-task-1-0-1",
      "source_ref": "local-fixture://pilot/pilot-task-1-0/1"
    },
    {
      "family_id": "pilot-family-1",
      "task_id": "pilot-task-1-0",
      "input_sha256": "b74d276f21a8303af2bdf1e8870f1a0071862eb8263f874dc0c1e3bca088c3dc",
      "repetition": 2,
      "with_score": 0.44,
      "without_score": 0.49,
      "with_run_id": "pilot-with-pilot-task-1-0-2",
      "without_run_id": "pilot-without-pilot-task-1-0-2",
      "with_session_id": "pilot-with-session-pilot-task-1-0-2",
      "without_session_id": "pilot-without-session-pilot-task-1-0-2",
      "source_ref": "local-fixture://pilot/pilot-task-1-0/2"
    },
    {
      "family_id": "pilot-family-1",
      "task_id": "pilot-task-1-1",
      "input_sha256": "5432540fbdcd7af1fc367390bff987260599b4859ca961907ef63c5513fe0e51",
      "repetition": 1,
      "with_score": 0.5599999999999999,
      "without_score": 0.51,
      "with_run_id": "pilot-with-pilot-task-1-1-1",
      "without_run_id": "pilot-without-pilot-task-1-1-1",
      "with_session_id": "pilot-with-session-pilot-task-1-1-1",
      "without_session_id": "pilot-without-session-pilot-task-1-1-1",
      "source_ref": "local-fixture://pilot/pilot-task-1-1/1"
    },
    {
      "family_id": "pilot-family-1",
      "task_id": "pilot-task-1-1",
      "input_sha256": "5432540fbdcd7af1fc367390bff987260599b4859ca961907ef63c5513fe0e51",
      "repetition": 2,
      "with_score": 0.68,
      "without_score": 0.53,
      "with_run_id": "pilot-with-pilot-task-1-1-2",
      "without_run_id": "pilot-without-pilot-task-1-1-2",
      "with_session_id": "pilot-with-session-pilot-task-1-1-2",
      "without_session_id": "pilot-without-session-pilot-task-1-1-2",
      "source_ref": "local-fixture://pilot/pilot-task-1-1/2"
    },
    {
      "family_id": "pilot-family-2",
      "task_id": "pilot-task-2-0",
      "input_sha256": "1d9d3a4fc1916f418bc3826d98b9800dabc9913c7f97d8f22950f57c358eb5cc",
      "repetition": 1,
      "with_score": 0.5599999999999999,
      "without_score": 0.51,
      "with_run_id": "pilot-with-pilot-task-2-0-1",
      "without_run_id": "pilot-without-pilot-task-2-0-1",
      "with_session_id": "pilot-with-session-pilot-task-2-0-1",
      "without_session_id": "pilot-without-session-pilot-task-2-0-1",
      "source_ref": "local-fixture://pilot/pilot-task-2-0/1"
    },
    {
      "family_id": "pilot-family-2",
      "task_id": "pilot-task-2-0",
      "input_sha256": "1d9d3a4fc1916f418bc3826d98b9800dabc9913c7f97d8f22950f57c358eb5cc",
      "repetition": 2,
      "with_score": 0.68,
      "without_score": 0.53,
      "with_run_id": "pilot-with-pilot-task-2-0-2",
      "without_run_id": "pilot-without-pilot-task-2-0-2",
      "with_session_id": "pilot-with-session-pilot-task-2-0-2",
      "without_session_id": "pilot-without-session-pilot-task-2-0-2",
      "source_ref": "local-fixture://pilot/pilot-task-2-0/2"
    },
    {
      "family_id": "pilot-family-2",
      "task_id": "pilot-task-2-1",
      "input_sha256": "0b3f621ec245887f8a9787a575c790df02cffa9bd015e623419a558271bc0349",
      "repetition": 1,
      "with_score": 0.7999999999999999,
      "without_score": 0.55,
      "with_run_id": "pilot-with-pilot-task-2-1-1",
      "without_run_id": "pilot-without-pilot-task-2-1-1",
      "with_session_id": "pilot-with-session-pilot-task-2-1-1",
      "without_session_id": "pilot-without-session-pilot-task-2-1-1",
      "source_ref": "local-fixture://pilot/pilot-task-2-1/1"
    },
    {
      "family_id": "pilot-family-2",
      "task_id": "pilot-task-2-1",
      "input_sha256": "0b3f621ec245887f8a9787a575c790df02cffa9bd015e623419a558271bc0349",
      "repetition": 2,
      "with_score": 0.92,
      "without_score": 0.5700000000000001,
      "with_run_id": "pilot-with-pilot-task-2-1-2",
      "without_run_id": "pilot-without-pilot-task-2-1-2",
      "with_session_id": "pilot-with-session-pilot-task-2-1-2",
      "without_session_id": "pilot-without-session-pilot-task-2-1-2",
      "source_ref": "local-fixture://pilot/pilot-task-2-1/2"
    }
  ]
}
